{"createdAtUtc":"2026-01-15T08:00:10.000Z","evidenceId":"11111111-1111-4111-8111-111111111111","manifestRootSha256":"5d32ea6188e95a8203df277dc3054d71ab086c759144b555f9dd4ae34aae798d","payloadManifests":[{"path":"manifest-sha256.txt","sha256":"c62b9f136dddd124db5d73113729b51b085f6562a0ebe895d652cd62e89bdf33"},{"path":"manifest-sha512.txt","sha256":"f02f2ac00208d8f7e0452ae99f962d9f4066dddc4a1b8684a288d41f98c704c2"}],"schemaVersion":"1.0.0","signature":{"algorithm":"Ed25519","signaturePath":"signatures/seal.ed25519","signedBytes":"exact-seal-json-utf8","signerFingerprint":"sha256:17f1694d3f0457248236d70a2346d7eece8862bab742a05d60d0dc1d9dc87591"},"tagFiles":[{"path":"bag-info.txt","sha256":"144b03202f64a5b4618ba465678ab7fd3a54865832ef5a8aaf106c1770f46ca8"},{"path":"bagit.txt","sha256":"1712ecfb074bf29c4188ad3421032509159a09739fd604f8fe57038b4ddefcc9"},{"path":"schemas/acquisition-1.0.schema.json","sha256":"96748ecfaa13355da33f0b258b428ac32e5dd2efd6c311e1179f0763a67a579d"},{"path":"schemas/acquisition-event-1.0.schema.json","sha256":"394bd02d3bff55ea3c1d3fbdb7787e94ae57b647704d18779e09800ff508c64e"},{"path":"schemas/capabilities-1.0.schema.json","sha256":"16951fd313a63a4b7b66796fd89776daf76b64056c960a2e106bbfd06bc0fc79"},{"path":"schemas/chat-completeness-1.0.schema.json","sha256":"d49f66b855f5457f20b6f4c130970b28613463c9921264e52e7f529f639919f7"},{"path":"schemas/common-1.0.schema.json","sha256":"0dbc6a1de6facad234a8848f4bb842aa5f537130c4149536ed0bd8e015b38584"},{"path":"schemas/completeness-1.0.schema.json","sha256":"794f93d8c33b191441d6984e017167a77a990fbdc67436c8771602d00733f937"},{"path":"schemas/dataset-inventory-1.0.schema.json","sha256":"9971891f1fd07c1d2452cc7e3252155d67d5a9fd1bf51b5546b82cba200be4c4"},{"path":"schemas/evidence-record-1.0.schema.json","sha256":"64c90ab62ca6c24590146a80f4e3716f0fec8a5c4a8c0fd924fe71bf263a4ca4"},{"path":"schemas/index.json","sha256":"9e03221200565648a94f82d90531e94b3598bbc9d4dacdb0aa741fe7f7547c23"},{"path":"schemas/media-record-1.0.schema.json","sha256":"5b074c77ea7052c151b2c2a661623f8bf47d74e4399ac3e0a0583d09163aa962"},{"path":"schemas/raw-record-1.0.schema.json","sha256":"561e91c166f804562df099e5d8ed01adc3ba8dfcc1125cb6853784c3890a0302"},{"path":"schemas/records/account-1.0.schema.json","sha256":"9b5d024ab33532eac02dd093e934dfd7181dec54c36e2d7b2c5c11087e5686d7"},{"path":"schemas/records/chat-1.0.schema.json","sha256":"42b832c49aff73ca6dbbe51ae057c2070d5d0ec4873075ff746782bdb4f54de0"},{"path":"schemas/records/chat-list-1.0.schema.json","sha256":"b349206bf7ca20a3ac51f6eb2c427cc92747d608e665dd4097bf4f6edbf50945"},{"path":"schemas/records/contact-1.0.schema.json","sha256":"c365181a5547beda11e5458237e5707a8a28b646aa70bd6862159361c3ed8f18"},{"path":"schemas/records/event-1.0.schema.json","sha256":"ad40188813a285392e0bd4316d138fa39b18169147445246009cdf9a61e2227c"},{"path":"schemas/records/generic-entity-1.0.schema.json","sha256":"ecc39e64a85ced9f6ca5ba040e21c33303315dafac0b40f45fc01955197a5f56"},{"path":"schemas/records/message-1.0.schema.json","sha256":"646e499c6f20283b4453eeeaa0493ccb8044798a97d891aee87e137335b254b1"},{"path":"schemas/records/participant-1.0.schema.json","sha256":"a51d9dfb551bc6d7af752f26c1ed4601db9835dcc8487ba994a15d69a2badaf5"},{"path":"schemas/records/relation-1.0.schema.json","sha256":"a9d7a506883c8b7ff26ff9e52bcda151223562433ff65e1d83bbba68923702ba"},{"path":"schemas/seal-1.0.schema.json","sha256":"f9e83b9e14d021f1d8c963c9daf4dbe3020da44999786b943895ecee819c5696"},{"path":"schemas/signer-1.0.schema.json","sha256":"e8579dbe706f05a91230552d5fdfccd3a61851f445b27ae27763ed2a77b5d17b"},{"path":"signatures/signer.json","sha256":"74dfb216588d3a777d02e2a278f6c236ffdcc18f0afd4998a3ce2f6bc0b25055"}],"waEvidenceBagVersion":"1.0.0-draft.1"}
